{
  "format": "readpack-attribution",
  "format_version": "2.0",
  "article": {
    "id": "44444444-4444-4444-8444-444444444444",
    "revision": 1
  },
  "resources": [
    {
      "resource_id": "article-source",
      "kind": "article_source",
      "role": "content",
      "name": "Layered Contract Article",
      "source": {
        "status": "known",
        "value": "Generated for the Engirdle contract fixture"
      },
      "version": {
        "status": "not_applicable"
      },
      "license": {
        "status": "known",
        "name": "CC0-1.0",
        "url": "https://creativecommons.org/publicdomain/zero/1.0/"
      },
      "modifications": {
        "status": "known",
        "value": "Synthetic fixture; no external article was used"
      },
      "hashes": [
        {
          "algorithm": "sha256",
          "value": "374093fb0426372b2c6ecbac84cd711cf5bc8a43bf461633d768cd4d30b55757"
        }
      ]
    },
    {
      "resource_id": "engirdle-pipeline",
      "kind": "software_dependency",
      "role": "pipeline",
      "name": "Engirdle PC pipeline",
      "source": {
        "status": "known",
        "value": "Engirdle repository"
      },
      "version": {
        "status": "known",
        "value": "0.1.0"
      },
      "license": {
        "status": "unknown"
      },
      "modifications": {
        "status": "not_applicable"
      },
      "hashes": []
    },
    {
      "resource_id": "translation-service",
      "kind": "translation_service",
      "role": "translation",
      "name": "DeepSeek API",
      "source": {
        "status": "known",
        "value": "https://api.deepseek.com"
      },
      "version": {
        "status": "known",
        "value": "deepseek-v4-flash"
      },
      "license": {
        "status": "not_applicable"
      },
      "modifications": {
        "status": "not_applicable"
      },
      "hashes": [],
      "notes": "The fixture translation is synthetic."
    },
    {
      "resource_id": "tts-custom-voice-model",
      "kind": "tts_model",
      "role": "custom_voice",
      "name": "Qwen3-TTS-12Hz-1.7B-CustomVoice",
      "source": {
        "status": "known",
        "value": "Qwen/Qwen3-TTS-12Hz-1.7B-CustomVoice"
      },
      "version": {
        "status": "known",
        "value": "fixture-revision"
      },
      "license": {
        "status": "unknown"
      },
      "modifications": {
        "status": "not_applicable"
      },
      "hashes": []
    },
    {
      "resource_id": "tts-base-model",
      "kind": "tts_model",
      "role": "base_voice_clone",
      "name": "Qwen3-TTS-12Hz-1.7B-Base",
      "source": {
        "status": "known",
        "value": "Qwen/Qwen3-TTS-12Hz-1.7B-Base"
      },
      "version": {
        "status": "known",
        "value": "fixture-revision"
      },
      "license": {
        "status": "unknown"
      },
      "modifications": {
        "status": "not_applicable"
      },
      "hashes": []
    },
    {
      "resource_id": "voice-profile",
      "kind": "voice_profile",
      "role": "narration",
      "name": "Synthetic fixture voice",
      "source": {
        "status": "known",
        "value": "Generated locally for contract testing"
      },
      "version": {
        "status": "known",
        "value": "1"
      },
      "license": {
        "status": "unknown"
      },
      "modifications": {
        "status": "not_applicable"
      },
      "hashes": []
    },
    {
      "resource_id": "audio-encoder",
      "kind": "software_dependency",
      "role": "audio_encoder",
      "name": "FFmpeg",
      "source": {
        "status": "known",
        "value": "https://ffmpeg.org/"
      },
      "version": {
        "status": "known",
        "value": "7.0.2-static"
      },
      "license": {
        "status": "unknown"
      },
      "modifications": {
        "status": "not_applicable"
      },
      "hashes": []
    }
  ]
}
